{
  "schema_version": 1,
  "kind": "system.tags",
  "source": "docs/system/01-内核CORE.md:202",
  "note": "标签不携带数值，是规则的关键词：某些规则只在两个特定标签相遇时触发。命名惯例：中文标签一律用【】框起。",
  "damage_tags": [
    {"id": "slash", "name": "斩击", "en": "Slash", "meaning": "刃器切割", "source": "docs/system/01-内核CORE.md:212"},
    {"id": "blunt", "name": "钝击", "en": "Blunt", "meaning": "冲击、坠落、重压", "source": "docs/system/01-内核CORE.md:213"},
    {"id": "pierce", "name": "穿刺", "en": "Pierce", "meaning": "锐器突刺、弹道", "source": "docs/system/01-内核CORE.md:214"},
    {"id": "flame", "name": "火焰", "en": "Flame", "meaning": "灼烧、引燃可燃物、失控扩散", "source": "docs/system/01-内核CORE.md:215"},
    {"id": "shock", "name": "电击", "en": "Shock", "meaning": "电流、过载、短路", "source": "docs/system/01-内核CORE.md:216"},
    {"id": "frost", "name": "寒霜", "en": "Frost", "meaning": "冻结、迟滞、凝固", "source": "docs/system/01-内核CORE.md:217"},
    {"id": "sonic", "name": "声波", "en": "Sonic", "meaning": "音爆、共振、干扰听觉", "source": "docs/system/01-内核CORE.md:218"},
    {"id": "corrode", "name": "腐蚀", "en": "Corrode", "meaning": "酸液、降解、氧化", "source": "docs/system/01-内核CORE.md:219"},
    {"id": "force", "name": "力场", "en": "Force", "meaning": "纯粹的动能力场、推拉、挤压", "source": "docs/system/01-内核CORE.md:220"},
    {"id": "psychic", "name": "精神", "en": "Psychic", "meaning": "直接作用于意识、恐惧、幻觉", "source": "docs/system/01-内核CORE.md:221"},
    {"id": "entropy", "name": "熵蚀", "en": "Entropy", "meaning": "侵蚀存在本身，异界特有的伤害类型", "source": "docs/system/01-内核CORE.md:222"}
  ],
  "property_tags": [
    {"id": "armor", "name": "装甲", "source": "docs/system/01-内核CORE.md:228"},
    {"id": "light_armor", "name": "轻装", "source": "docs/system/01-内核CORE.md:228"},
    {"id": "heavy_armor", "name": "重装", "source": "docs/system/01-内核CORE.md:228"},
    {"id": "mobile", "name": "机动", "source": "docs/system/01-内核CORE.md:228"},
    {"id": "fine", "name": "精细", "source": "docs/system/01-内核CORE.md:228"},
    {"id": "ranged", "name": "远程", "source": "docs/system/01-内核CORE.md:228"},
    {"id": "melee", "name": "近战", "source": "docs/system/01-内核CORE.md:228"},
    {"id": "two_handed", "name": "双手", "source": "docs/system/01-内核CORE.md:228"},
    {"id": "one_handed", "name": "单手", "source": "docs/system/01-内核CORE.md:228"},
    {"id": "concealed", "name": "隐蔽", "source": "docs/system/01-内核CORE.md:228"},
    {"id": "conspicuous", "name": "显眼", "source": "docs/system/01-内核CORE.md:228"},
    {"id": "resonant", "name": "共鸣", "source": "docs/system/01-内核CORE.md:228"},
    {"id": "arcane", "name": "奥术", "source": "docs/system/01-内核CORE.md:228"},
    {"id": "holy", "name": "神圣", "source": "docs/system/01-内核CORE.md:228"},
    {"id": "profane", "name": "亵渎", "source": "docs/system/01-内核CORE.md:228"},
    {"id": "tech", "name": "技术", "source": "docs/system/01-内核CORE.md:228"},
    {"id": "living", "name": "生物", "source": "docs/system/01-内核CORE.md:228"},
    {"id": "energy", "name": "能量", "source": "docs/system/01-内核CORE.md:228"},
    {"id": "floating", "name": "悬浮", "source": "docs/system/01-内核CORE.md:228"},
    {"id": "colossal", "name": "巨物", "source": "docs/system/01-内核CORE.md:228"},
    {"id": "small", "name": "小型", "source": "docs/system/01-内核CORE.md:228"},
    {"id": "swarm", "name": "swarm 集群", "source": "docs/system/01-内核CORE.md:228"},
    {"id": "breakable", "name": "可破坏", "source": "docs/system/01-内核CORE.md:228"},
    {"id": "volatile", "name": "挥发", "source": "docs/system/01-内核CORE.md:228"},
    {"id": "conductive", "name": "导电", "source": "docs/system/01-内核CORE.md:228"},
    {"id": "flammable", "name": "易燃", "source": "docs/system/01-内核CORE.md:228"},
    {"id": "resonance_amplifier", "name": "共鸣放大器", "source": "docs/system/01-内核CORE.md:228"},
    {"id": "spirit_linked", "name": "灵犀", "source": "docs/system/01-内核CORE.md:228"},
    {"id": "mechanical", "name": "机械", "source": "docs/system/01-内核CORE.md:228"},
    {"id": "flesh", "name": "血肉", "source": "docs/system/01-内核CORE.md:228"},
    {"id": "psionic", "name": "灵能", "source": "docs/system/01-内核CORE.md:228"},
    {"id": "mountable", "name": "可搭载", "source": "docs/system/01-内核CORE.md:228"},
    {"id": "polluted", "name": "污染", "source": "docs/system/01-内核CORE.md:228"}
  ],
  "interaction_principles": [
    {"order": 1, "name": "虚构优先",
     "rule": "如果两个标签的组合在叙事上明显说得通（汽油 × 火焰），按常识处理，通常给出 1 层额外增益（如 +1 助势骰或伤害 +2）",
     "source": "docs/system/01-内核CORE.md:236"},
    {"order": 2, "name": "宁可对玩家有利",
     "rule": "在不破坏场景的前提下，标签创意用法应当被奖励而非刁难。玩家动脑去观察环境是应当被鼓励的行为",
     "source": "docs/system/01-内核CORE.md:237"},
    {"order": 3, "name": "不得重复获利",
     "rule": "同一场合同一个创意不得重复获取同额收益，避免“我每次都用汽油”变成固定套路",
     "source": "docs/system/01-内核CORE.md:238"}
  ]
}
